{
  "schema_version": 1,
  "vector_id": "liboqs-ml-kem-512-roundtrip-001",
  "suite": "liboqs-smoke",
  "algorithm": "ML-KEM",
  "parameter_set": "ML-KEM-512",
  "operation": "roundtrip",
  "inputs": {},
  "expected": {
    "roundtrip": true,
    "public_key_length": 800,
    "secret_key_length": 1632,
    "ciphertext_length": 768,
    "shared_secret_length": 32
  },
  "metadata": {
    "comparison": "semantic",
    "claim": "liboqs adapter execution and internal KEM round trip"
  }
}
